{
  "session": "s10",
  "goal": "Save/load and share-seed round trip: save from the pause menu, stop, `pt start --continue`, confirm the world is identical; then start a new world from the seed shown on the Share screen and confirm it matches. This build changed the save format (v6) to store diplomacy envoys. Before saving, lead a nation and make at least one diplomacy act on the Nations screen (O) so an envoy is on the road; save while it is away, quit, `pt start --continue`, and confirm the envoy is still away with the same remaining time (Nations screen row 'envoy back in N s') and the rest of the world matches.",
  "build": {
    "version": "0.6.3",
    "commit": "a44aa8d"
  },
  "seed": "Ironvale",
  "durationSec": 543,
  "outcome": "achieved",
  "findings": [
    {
      "severity": "minor",
      "category": "ux",
      "title": "Nations screen status line shows a stale envoy countdown that contradicts the row",
      "detail": "After clicking Tribute twice on Fortresstown, the bottom status line says 'you can deal with them again in 20 seconds of play'. Later, when I reopened the Nations screen, the row read 'envoy back in 11 s' but the status line still said 20 seconds. I expected the status line to clear when the screen reopens, or to show the live remaining time.",
      "repro": "pt start --seed Ironvale; Start, Begin; pt key n; wait for an AI nation; pt key o; click Tribute (123,255) twice; Escape; let ~8 s of game time pass; pt key o",
      "screenshot": "shots/nations_presave2.png",
      "tick": 2178
    },
    {
      "severity": "minor",
      "category": "ux",
      "title": "Diplomacy buttons look active while the envoy is away, and nothing tells you when it returns",
      "detail": "While 'envoy back in N s' is showing, Fortresstown's Tribute/Ally/War/Denounce buttons are drawn exactly like the active ones. Clicking them only shows an 'envoy still on the road' status. When the envoy came back, no status message or chronicle entry appeared; the only sign was that the row suffix was gone (seen at tick 2770). I expected greyed-out buttons during the cooldown and a short 'your envoy has returned from X' notice.",
      "repro": "Same as above; close Nations; wait for about 20 game seconds; pt key o; pt events 15 shows no envoy-return event",
      "screenshot": "shots/nations_envoyback.png",
      "tick": 2770
    },
    {
      "severity": "polish",
      "category": "ux",
      "title": "Ctrl+A does not select all in the New World seed box",
      "detail": "Pasting the numeric seed from Share: clicking the box, pressing Ctrl+A, then BackSpace removed only one character, so typing gave 'Ironval1450162717' (seed 1889372902, a different world). The preview line ('X is seed N') caught it, which is good. I had to press BackSpace 25 times. I expected Ctrl+A to select all, or the box to select all its text when it gets focus.",
      "repro": "Main Menu > Start; click seed box (480,235); pt key ctrl+a; pt key BackSpace; pt type 1450162717",
      "screenshot": "shots/nw3.png",
      "tick": null
    }
  ],
  "metrics": {
    "objectivesCompleted": 0,
    "deaths": 0,
    "secondsToObjective": {},
    "saveTick": 2206,
    "envoyDueTick": 2686,
    "envoyRemainingAtSaveSec": 9.6,
    "envoyShownAfterLoadSec": 6,
    "tickWhenCheckedAfterLoad": 2406,
    "relationAfterLoad": 10,
    "coinsBeforeSave": 231,
    "coinsAfterLoad": 231,
    "shareSeed": 1450162717,
    "seedWorldMatched": true,
    "avgTps": 10
  },
  "fun": 3,
  "verdict": "The v6 save keeps diplomacy envoys correctly. An envoy sent at tick 1686 and saved at tick 2206 came back after --continue showing 'envoy back in 6 s' at tick 2406, which matches the math exactly. Relations (+10), coins, position, energy, objective and nation/leader role also survived, and the envoy returned on schedule. The Share seed (1450162717) typed into New World rebuilt an identical starting world. The rough edges are all diplomacy feedback: a stale countdown in the status line, cooldown buttons that look active, and no notice when the envoy returns."
}